{
 "schema_version": "gnd-ilp-run/1",
 "learner": {
  "name": "popper",
  "version": "0.0.0+authored"
 },
 "export_sha256": "218611fc16203831a81d1f35af60aa494c3b7f92df3b91772e52b149c9629a46",
 "clauses_sha256": "92303b09378475e2dc75a1628b30576032562b65d6c7225914f77d4865233367",
 "coverage": [
  {
   "clause": 0,
   "covered": []
  }
 ]
}
