{
 "schema_version": "gnd-ilp-run/1",
 "learner": {
  "name": "popper",
  "version": "0.0.0+authored"
 },
 "export_sha256": "0ee67d238eaf0286e3e7ecae9baa1c8f331b24892124f9091fdfd6f10412788c",
 "clauses_sha256": "4a38a92450be28809dd308923304b81bb8555289d7b5060d750803c7e1023af4",
 "coverage": [
  {
   "clause": 0,
   "covered": []
  }
 ]
}
