{
 "schema_version": "gnd-ilp-run/1",
 "learner": {
  "name": "popper",
  "version": "0.0.0+authored"
 },
 "export_sha256": "218611fc16203831a81d1f35af60aa494c3b7f92df3b91772e52b149c9629a46",
 "clauses_sha256": "034fab166060755948faa8f84a8dd7605f505a62e1cf8c72ca437e55e63bf6f2",
 "coverage": [
  {
   "clause": 0,
   "covered": []
  }
 ]
}
