{
 "schema_version": "gnd-ilp-run/1",
 "learner": {
  "name": "popper",
  "version": "0.0.0+authored"
 },
 "export_sha256": "0ee67d238eaf0286e3e7ecae9baa1c8f331b24892124f9091fdfd6f10412788c",
 "clauses_sha256": "4424e3c3a10ec0ece8d6dc4aba7bb3967f1802d20d0591f1dea8faf408eb4003",
 "coverage": [
  {
   "clause": 0,
   "covered": [
    "n1",
    "n2"
   ]
  },
  {
   "clause": 1,
   "covered": [
    "n2",
    "n3"
   ]
  },
  {
   "clause": 2,
   "covered": [
    "n1",
    "n2",
    "p1",
    "p2"
   ]
  }
 ]
}
