{
 "schema_version": "gnd-ilp-run/1",
 "learner": {
  "name": "popper",
  "version": "0.0.0+authored"
 },
 "export_sha256": "218611fc16203831a81d1f35af60aa494c3b7f92df3b91772e52b149c9629a46",
 "clauses_sha256": "7e46799ba194c69109d7e925c97c548cff3214c644761153482e3309593702b9",
 "coverage": [
  {
   "clause": 0,
   "covered": []
  }
 ]
}
