{
 "schema_version": "gnd-ilp-run/1",
 "learner": {
  "name": "popper",
  "version": "0.0.0+authored"
 },
 "export_sha256": "218611fc16203831a81d1f35af60aa494c3b7f92df3b91772e52b149c9629a46",
 "clauses_sha256": "b006eb25251493e838e0b4196c7af4ad64492a81962bcb8c2390b9ab654e2ee1",
 "coverage": [
  {
   "clause": 0,
   "covered": []
  }
 ]
}
